<?xml version="1.0" encoding="UTF-8"?>
<?xml-stylesheet type="text/xsl" href="style.xsl"?>
<!DOCTYPE TEI SYSTEM "progetto.dtd">
<TEI xmlns="http://www.tei-c.org/ns/1.0">
    <teiHeader>
        <fileDesc>
            <titleStmt>
                <title>Bibliografia: Giovanni De Castro</title>
                <respStmt>
                    <resp>Progetto di codifica di testi</resp>
                    <name>Beggiato Camilla e Franchi Gemma</name>
                </respStmt>
            </titleStmt>
            <publicationStmt>
                <p>Edizione digitale didattica</p>
            </publicationStmt>
            <sourceDesc>
                <bibl>
                    <title>La Rassegna Settimanale</title>
                    <biblScope unit="volume">1</biblScope>
                    <biblScope unit="issue">8</biblScope>
                    <date when="1878-02-24">24 Febbraio 1878</date>
                </bibl>
            </sourceDesc>
        </fileDesc>
    </teiHeader>

    <facsimile>
        <surface xml:id="pag142">
            <graphic url="Bibliografia 1.jpg" width="733px" height="1073px"/>
            <zone xml:id="bib_titolo" ulx="52" uly="880" lrx="378" lry="891"/>
            <zone xml:id="bib_pubblicazione" ulx="74" uly="895" lrx="168" lry="904"/>
            <zone xml:id="bib_p1" ulx="55" uly="928" lrx="378" lry="996"/>
            <zone xml:id="bib_p2" ulx="384" uly="77" lrx="708" lry="165"/>
            <zone xml:id="bib_p3" ulx="385" uly="172" lrx="707" lry="360"/>
            <zone xml:id="bib_p4" ulx="387" uly="367" lrx="707" lry="416"/>
        </surface>
    </facsimile>

    <text>
        <body>
            <div type="bibliografia">
                <head facs="#bib_titolo">
                    <bibl>
                        <author>
                            <forename>GIOVANNI</forename>
                            <surname>DE CASTRO</surname>
                        </author>.
                        <title>I popoli dell'antico Oriente, volumi due.</title>
                    </bibl>
                </head>

                <p facs="#bib_pubblicazione">
                    — <pubPlace>Milano</pubPlace>, <date>1878</date>.
                </p>

                <p facs="#bib_p1">
                    <lb/>In quest'opera l'Autore s'è proposto di darci <quote>« un rac-
                    <lb/>conto del tutto familiare delle vicende »</quote> de' popoli orientali
                    <lb/>trattando delle <quote>« società e stati che fiorirono nell'<placeName>Asia</placeName> ante-
                    <lb/>riore, colà ove gli Italiani, fin d'antico, ebbero dominio e poi
                    <lb/>quella dimestichezza, migliore della conquista, che il com-
                    <lb/>mercio agevola e raffina »</quote> (p. x): ossia, in altri termini, trat-
                </p>

                <p facs="#bib_p2">
                    <lb/>tando di tutte quelle schiatte e nazioni, la cui storia forma
                    <lb/>argomento d'ogni altro libro di simil genere. Le civiltà che
                    <lb/>nacquero e si svolsero per tutto il territorio compreso fra
                    <lb/>l'<placeName>Indo</placeName> e il <placeName>Mar Nero</placeName>, sulle coste asiatiche del <placeName>Mediterraneo</placeName>,
                    <lb/>e nella valle del <placeName>Nilo</placeName>, passano rapidamente dinanzi agli
                    <lb/>occhi del lettore, in quadri non di rado ben disegnati.
                </p>

                <p facs="#bib_p3">
                    <lb/>Se il signor <persName>De Castro</persName> ha avuto in animo di fare un
                    <lb/>libro di amena e piacevole lettura, egli c'è riuscito in
                    <lb/>molta parte. E in tal caso non gli s'avrebbe che a rim-
                    <lb/>proverare qualche difettuccio di forma, un criterio non
                    <lb/>sempre uniforme nel coordinare i fatti e nella scelta dei
                    <lb/>medesimi, e il promettere, alcuna volta, ne' titoli de' capi-
                    <lb/>toli più di quel che spesso vi si trova. Così, per esempio,
                    <lb/>in un luogo il lettore s'aspetta d'aver notizie sulla lette-
                    <lb/>ratura egiziana; e poi vien solo a sapere, che nel <placeName>Rama-
                    <lb/>seum</placeName> a <placeName>Karnak</placeName> nove piccole stanze dovevano contener
                    <lb/>papiri, perchè sulla porta d'ingresso sta l'immagine di
                    <lb/><persName>Thot</persName>, Dio della letteratura: il quale del resto si trova ef-
                    <lb/>figiato anche su altre porte che non mettono sempre a bi-
                    <lb/>blioteche. In altro luogo si promette di dire alcuna cosa
                    <lb/>de' primi ricordi storici degli Arii, e poi non si trovano
                    <lb/>che poche parole intorno allo <hi rend="italic"><title>Sciah-nameh</title></hi>. Ma se, oltre a
                    <lb/>un libro d'amena lettura, l'Autore avesse anche inteso di
                    <lb/>fare un lavoro che dovesse servir davvero all'incremento
                    <lb/>degli studi, per quel che concerne la storia orientale, egli
                    <lb/>non ha pienamente conseguito lo scopo. Inquantochè, a
                    <lb/>parer nostro, manca in queste pagine quello che uno stu-
                    <lb/>dioso di buona volontà cerca, e ha diritto di trovare, anche
                    <lb/>in un libro elementare di questo genere: cioè a dire un
                    <lb/>aiuto che lo metta sulla strada di procurarsi più solide e
                    <lb/>amplie notizie della materia a cui egli attende. Mai una
                    <lb/>citazione viene a confortare le asserzioni dell'Autore; mai
                    <lb/>uno di que' nomi legati alle più belle e recenti conquiste
                    <lb/>dell'<term>Archeologia orientale</term>, si porge alla memoria di chi legge.
                </p>

                <p facs="#bib_p4">
                    <lb/>Se il signor <persName>De Castro</persName>, in altra edizione, riuscisse a ri-
                    <lb/>mediare a ciò, potrebbe rendere molto più utile il suo libro,
                    <lb/>senza che ne scapitasse il diletto, che viene dalla forma fa-
                    <lb/>miliare e viva con cui egli s'è adoperato ad esporre i fatti.
                </p>
            </div>
        </body>
    </text>
</TEI>