<?xml version="1.0" encoding="UTF-8"?>
<?xml-stylesheet type="text/xsl" href="style.xsl"?>
<!DOCTYPE TEI SYSTEM "progetto.dtd">
<TEI xmlns="http://www.tei-c.org/ns/1.0">
    <teiHeader>
        <fileDesc>
            <titleStmt>
                <title>Notizie</title>
                <respStmt>
                    <resp>Progetto di codifica di testi</resp>
                    <name>Beggiato Camilla e Franchi Gemma</name>
                </respStmt>
            </titleStmt>
            <publicationStmt>
                <p>Edizione digitale didattica</p>
            </publicationStmt>
            <sourceDesc>
                <bibl>
                    <title>La Rassegna Settimanale</title>
                    <biblScope unit="volume">1</biblScope>
                    <biblScope unit="issue">8</biblScope>
                    <date when="1878-02-24">24 Febbraio 1878</date>
                </bibl>
            </sourceDesc>
        </fileDesc>
    </teiHeader>

    <facsimile>
        <surface xml:id="pag144">
            <graphic url="Notizie 1.jpg" width="727px" height="1063px" />
            <zone xml:id="not_titolo" ulx="175" uly="750" lrx="239" lry="761" />
            <zone xml:id="not_monaci" ulx="43" uly="767" lrx="366" lry="801" />
            <zone xml:id="not_trollope" ulx="44" uly="807" lrx="366" lry="825" />
            <zone xml:id="not_manzoni" ulx="44" uly="829" lrx="366" lry="888" />
            <zone xml:id="not_amari" ulx="43" uly="894" lrx="366" lry="975" />
            <zone xml:id="not_thiers" ulx="382" uly="68" lrx="704" lry="91" />
            <zone xml:id="not_bitard" ulx="380" uly="96" lrx="702" lry="157" />
            <zone xml:id="not_bigot" ulx="381" uly="161" lrx="702" lry="261" />
            <zone xml:id="not_hellwald" ulx="381" uly="264" lrx="702" lry="311" />
            <zone xml:id="not_westminster" ulx="380" uly="315" lrx="702" lry="410" />
            <zone xml:id="not_besant" ulx="380" uly="415" lrx="700" lry="484" />
            <zone xml:id="not_samter" ulx="378" uly="489" lrx="700" lry="539" />
            <zone xml:id="not_bamberger" ulx="377" uly="543" lrx="700" lry="575" />
            <zone xml:id="not_social" ulx="378" uly="580" lrx="700" lry="612" />
            <zone xml:id="not_wilson" ulx="379" uly="617" lrx="700" lry="676" />
            <zone xml:id="not_archeo" ulx="377" uly="681" lrx="700" lry="928" />
        </surface>
    </facsimile>

    <text>
        <body>
            <div type="notizie">
                <head facs="#not_titolo">NOTIZIE.</head>
                
                <p facs="#not_monaci">
                    <lb/>— <persName>Ernesto Monaci</persName>, professore di lingue romanze all'Università di
                    <lb/><placeName>Roma</placeName>, ha scoperto un manoscritto importante, relativo alla storia di
                    <lb/><persName>Federigo Barbarossa</persName>. È un poema di quasi 3000 versi latini.
                </p>
                
                <p facs="#not_trollope">
                    <lb/>— La <title>Vita di Pio IX</title> di <persName>Tommaso Adolfo Trollope</persName> (2 vol. <orgName>Bentley</orgName>)
                    <lb/>recentemente pubblicata in inglese, non incontra il favor della critica.
                </p>
                
                <p facs="#not_manzoni">
                    <lb/>— Nell'annunziare la pubblicazione del poema, finora sconosciuto,
                    <lb/>del <persName>Manzoni</persName> <title>Del Trionfo della libertà</title>, il <orgName><hi rend="italic">Magazin für die Literatur des
                    <lb/>Auslandes</hi></orgName> (<date>16 febbraio</date>) fa notare l'importanza di questo lavoro.
                </p>
                
                <p facs="#not_amari">
                    <lb/>— Il professor <persName>Amari</persName> si applica indefessamente alla traduzione ita-
                    <lb/>liana, con note ec., della <title>Biblioteca arabo-sicula</title> ossia <title>Raccolta di testi
                    <lb/>arabici che toccano la Geografia, la Storia, le Biografie e la Bibliografia</title>
                    <lb/><hi rend="italic">della <placeName>Sicilia</placeName></hi>.
                </p>
                
                <p facs="#not_thiers">
                    <lb/>— Si annunzia la prossima pubblicazione delle orazioni del <persName>Thiers</persName>
                    <lb/>pronunziate da lui come presidente della Repubblica (1871-73).
                </p>
                
                <p facs="#not_bitard">
                    <lb/>— Il <persName>Bitard</persName> ha pubblicato (da <orgName>Dreyfus</orgName> a <placeName>Parigi</placeName>) un <title>Dizionario ge-
                    <lb/>nerale della biografia contemporanea</title> che l'<orgName><hi rend="italic">Athenaeum</hi></orgName> giudica
                    <lb/>superiore a quello del <persName>Vapereau</persName>.
                </p>
                
                <p facs="#not_bigot">
                    <lb/>— Nella <orgName><hi rend="italic">Revue politique et littéraire</hi></orgName> (<date>16 febbraio</date>) <persName>Charles Bigot</persName> di-
                    <lb/>scorre del pontificato di <persName>Pio IX</persName>.
                </p>
                
                <p facs="#not_hellwald">
                    <lb/>— Nell' <orgName><hi rend="italic">Ausland</hi></orgName>, n. 1-6, <persName>Fr. Hellwald</persName> ha pubblicato degli studi
                    <lb/>sulla quistione d'Oriente considerandola come quistione di civiltà.
                </p>
                
                <p facs="#not_westminster">
                    <lb/>— Nella <orgName><hi rend="italic">Westminster Review</hi></orgName> del <date when="1878-01">Gennaio 1878</date>, si esaminano le pub-
                    <lb/>blicazioni di statistica fatto per cura del cessato Ministero di Agricoltura.
                </p>
                
                <p facs="#not_besant">
                    <lb/>— Nell'articolo <title>Il movimento Maltusiano in Inghilterra</title>, pubblicato
                    <lb/>nel n. 7 della <orgName><hi rend="italic">Rassegna</hi></orgName>, annunziammo che la signora <persName>Besant</persName> e l'editore
                    <lb/><persName>Bradlaugh</persName> si erano appellati contro la sentenza.
                </p>
                
                <p facs="#not_samter">
                    <lb/>— Nella <orgName><hi rend="italic">Gegenwart</hi></orgName> (n. 6), <persName>Walter Rogge</persName> fa un resoconto molto fa-
                    <lb/>vorevole del libro di <persName>Adolfo Samter</persName>, <title>Sulla proprietà collettiva</title>.
                </p>
                
                <p facs="#not_bamberger">
                    <lb/>— Nella <orgName><hi rend="italic">Rundschau</hi></orgName> del <date>febbraio</date> il <persName>Bamberger</persName> ci fa il quadro del
                    <lb/>socialismo in <placeName>Germania</placeName>.
                </p>
                
                <p facs="#not_social">
                    <lb/>— Si annunzia la prossima pubblicazione a <placeName>Londra</placeName> di una nuova
                    <lb/>Rivista settimanale, <title>Social Notes</title>, diretta da <persName>S. C. Hall</persName>.
                </p>
                
                <p facs="#not_wilson">
                    <lb/>— Nell' <orgName><hi rend="italic">Academy</hi></orgName> (<date>9 febbraio</date>), <persName>Charles Heath Wilson</persName> fa la descri-
                    <lb/>zione di un sepolcro antico a <placeName>San Germano</placeName>.
                </p>
                
                <p facs="#not_archeo">
                    <lb/>— Quasi tutti i giornali di <placeName>Europa</placeName> hanno ripetuto in questi ultimi
                    <lb/>tempi la falsa notizia di meravigliose scoperte di antichità fatte presso
                    <lb/>l'antica <placeName>Siponto</placeName>, non lungi da <placeName>Manfredonia</placeName>.
                </p>
            </div>
        </body>
    </text>
</TEI>