<?xml version="1.0" encoding="UTF-8"?>
<?xml-stylesheet type="text/xsl" href="style.xsl"?>
<!DOCTYPE TEI SYSTEM "progetto.dtd">
<TEI xmlns="http://www.tei-c.org/ns/1.0">
    <teiHeader>
        <fileDesc>
            <titleStmt>
                <title>Il Congresso Igienico di Milano</title>
                <respStmt>
                    <resp>Progetto di codifica di testi</resp>
                    <name>Beggiato Camilla e Franchi Gemma</name>
                </respStmt>
            </titleStmt>
            <publicationStmt>
                <p>Edizione digitale didattica</p>
            </publicationStmt>
            <sourceDesc>
                <bibl>
                    <title>La Rassegna Settimanale</title>
                    <biblScope unit="volume">8</biblScope>
                    <biblScope unit="issue">204</biblScope>
                    <date when="1881-11-27">27 Novembre 1881</date>
                </bibl>
            </sourceDesc>
        </fileDesc>
    </teiHeader>

    <facsimile>
        <surface xml:id="pag350">
            <graphic url="Articolo 3.jpg" width="739.4px" height="1063.4px" />
            <zone xml:id="a3_p1_titolo" ulx="406" uly="756" lrx="664" lry="776" />
            <zone xml:id="a3_p1" ulx="379" uly="776" lrx="699" lry="829" />
            <zone xml:id="a3_p2" ulx="375" uly="832" lrx="699" lry="868" />
        </surface>

        <surface xml:id="pag351">
            <graphic url="Articolo 3 pag2.jpg" width="738.4px" height="1058.4px" />
            <zone xml:id="a3_p3" ulx="34" uly="43" lrx="358" lry="138" />
            <zone xml:id="a3_p4" ulx="35" uly="140" lrx="359" lry="203" />
            <zone xml:id="a3_p5" ulx="35" uly="207" lrx="359" lry="296" />
            <zone xml:id="a3_firma" ulx="282" uly="300" lrx="343" lry="312" />
        </surface>
    </facsimile>

    <text>
        <body>
            <div type="articolo">
                
                <pb n="350" facs="#pag350"/>
                
                <head facs="#a3_p1_titolo">IL CONGRESSO IGIENICO DI <placeName>MILANO</placeName>.</head>
                
                <opener>
                    <salute>Al Direttore.</salute>
                </opener>

                <p facs="#a3_p1">
                    <lb/>L'articolo della <orgName>Rassegna</orgName> (<bibl>vol. VIII, pag. 274</bibl>) sul <hi rend="italic"><term>Con-
                    <lb/>gresso Igienico</term></hi> tenutosi nel <date when="1881-09">settembre</date> a <placeName>Milano</placeName>, pecca di
                    <lb/>non poche inesattezze.
                </p>

                <p facs="#a3_p2">
                    <lb/>Non è giusta l'asserzione che al <orgName>Congresso</orgName> sia stata
                    <lb/>impossibile <quote>« ogni larva di studio o d'esame. »</quote> Infatti i temi
                    <lb/>erano stati annunciati assai tempo prima affinchè ciascuno
                    <lb/>avesse tempo a prepararcisi. Le discussioni animatissime
                    <lb/>che vi si agitarono, mostrarono che non sempre le parole del
                    <lb/>relatore erano accolte ciecamente e tumultuosamente, come
                    <lb/>lascia supporre l'articolista. Mi basti l'accennare, ad esempio,
                    <lb/>la votazione dell'assemblea sulle proposte del relatore pro-
                    <lb/>fessore <persName>Pagliani</persName> rispetto al miglior sistema di <term>fognatura</term>
                    <lb/>delle città.
                </p>

                <pb n="351" facs="#pag351"/>

                <p facs="#a3_p3">
                    <lb/>Nel giudizio che la <orgName>Rassegna</orgName> porta sulla relazione del
                    <lb/>prof. <persName>Sormani</persName> al tema: <title><hi rend="italic">Profilassi delle malattie veneree</hi></title>, si
                    <lb/>parla di <quote>« statistiche parziali, per diversi rispetti eccepibili, di
                    <lb/>affastellamento irrazionale di cifre. »</quote> Ora il <persName>Sormani</persName> stette ri-
                    <lb/>gorosamente alle risultanze di sole cifre ufficiali.
                </p>

                <p facs="#a3_p4">
                    <lb/>Nè sussiste l'accusa che sulle conclusioni del sig. <persName>Sor-
                    <lb/>mani</persName> si sia votato <quote>« senza discussione, »</quote> chè anzi l'ordine del
                    <lb/>giorno del prof. <persName>De Giovanni</persName> che sanzionò quelle conclusioni
                    <lb/>superò un vivissimo dibattito. Nè si può dire mancante
                    <lb/>di serietà tale votazione, perchè col sig. <persName>Sormani</persName> stette la
                    <lb/>gran maggioranza dei medici.
                </p>

                <p facs="#a3_p5">
                    <lb/>Finalmente la <orgName>Rassegna</orgName> accusa il <persName>Sormani</persName> d'aver pro-
                    <lb/>posto brutalmente l'estensione della <term>visita sanitaria</term> alle donne
                    <lb/>addette a stabilimenti industriali. Ora nè egli, nè nessun
                    <lb/>altro ha mai pensato di comprare a prezzo della <term>pubblica
                    <lb/>moralità</term> il più lieve vantaggio sociale. Egli accennò invece
                    <lb/>all'opportunità di estendere la visita sanitaria, oltre che ai
                    <lb/>soldati di terra e di mare, agli <term>operai celibi</term> delle grandi in-
                    <lb/>dustrie; e tra quest'ultima proposta e la prima ognun vede
                    <lb/>l'immensa differenza.
                </p>

                <closer>
                    <signed facs="#a3_firma"><hi rend="italic">Dev.mo</hi> T.</signed>
                </closer>
            </div>
        </body>
    </text>
</TEI>