<?xml version="1.0" encoding="UTF-8"?>
<?xml-stylesheet type="text/xsl" href="style.xsl"?>
<!DOCTYPE TEI SYSTEM "progetto.dtd">
<TEI xmlns="http://www.tei-c.org/ns/1.0">
    <teiHeader>
        <fileDesc>
            <titleStmt>
                <title>Notizie - Vol 8</title>
                <respStmt>
                    <resp>Progetto di codifica di testi</resp>
                    <name>Beggiato Camilla e Franchi Gemma</name>
                </respStmt>
            </titleStmt>
            <publicationStmt>
                <p>Edizione digitale didattica</p>
            </publicationStmt>
            <sourceDesc>
                <bibl>
                    <title>La Rassegna Settimanale</title>
                    <biblScope unit="volume">8</biblScope>
                    <biblScope unit="issue">204</biblScope>
                    <date when="1881-11-27">27 Novembre 1881</date>
                </bibl>
            </sourceDesc>
        </fileDesc>
    </teiHeader>

    <facsimile>
        <surface xml:id="pag352">
            <graphic url="Notizie 2.jpg" width="738.4px" height="1061.4px"/>
            
            <zone xml:id="notizie_titolo" ulx="527" uly="504" lrx="593" lry="520"/>
            
            <zone xml:id="notizie_n1" ulx="399" uly="523" lrx="720" lry="572"/>
            
            <zone xml:id="notizie_n2" ulx="399" uly="577" lrx="722" lry="596"/>
            
            <zone xml:id="notizie_n3" ulx="397" uly="599" lrx="725" lry="892"/>
        </surface>
    </facsimile>

    <text>
        <body>
            <div type="notizie">
                <head facs="#notizie_titolo">NOTIZIE.</head>
                
                <p facs="#notizie_n1">
                    <lb/>— La Commissione, incaricata di pubblicare le lettere e gli scritti
                    <lb/>di <persName>Pietro il Grande</persName>, comincerà, potendo, quest'anno la stampa del suo
                    <lb/>lavoro. Chiunque possieda manoscritti di <persName>Pietro il Grande</persName> o scritti da
                    <lb/>lui firmati è pregato di mandarli alla Commissione, che fattili copiare,
                    <lb/>glie li renderà o gli darà un esemplare della pubblicazione.
                </p>

                <p facs="#notizie_n2">
                    <lb/>— È annunziata per la fine di quest'anno la pubblicazione della
                    <lb/>traduzione dell'<title><hi rend="italic">Ecclesiaste</hi></title>, di <persName>Ernesto Renan</persName>
                    con una estesa prefazione.
                </p>

                <p facs="#notizie_n3">
                    <lb/>— In una biblioteca privata in <placeName>Inghilterra</placeName> si è trovato un mano-
                    <lb/>scritto contenente un poema francese fino ad oggi completamente sco-
                    <lb/>nosciuto, il cui argomento è la storia particolareggiata di <persName>Guglielmo
                    <lb/>il Maresciallo</persName>, conte di <placeName>Pembroke</placeName>, che fu reggente d'<placeName>Inghilterra</placeName> nei
                    <lb/>primi anni della minorità di <persName>Enrico III</persName>. Questo poema, che non con-
                    <lb/>tiene meno di 19212 versi ottosillabici dev'essere stato composto negli
                    <lb/>anni che seguirono la morte di <persName>Guglielmo il Maresciallo</persName>, cioè poco dopo
                    <lb/>il 1219. L'autore non si nomina, ma fa conoscere chi gli fornì gli ele-
                    <lb/>menti (che dovevano essere molto numerosi e molto esatti) del suo la-
                    <lb/>voro; era un certo <persName>Giovanni Erlea</persName>, che figura frequentemente nei do-
                    <lb/>cumenti diplomatici del tempo di <persName>Giovanni senza terra</persName> e di <persName>Enrico III</persName>
                    <lb/>sotto il nome di <foreign xml:lang="la"><hi rend="italic">Johannes de Erlegia</hi></foreign>. Era stato scudiero di <persName>Guglielmo
                    <lb/>il Maresciallo</persName> e più tardi uno dei suoi cavalieri. Il poema abbonda di
                    <lb/>ragguagli assolutamente nuovi e di una incontestabile autenticità su
                    <lb/>una infinità di punti della storia della <placeName>Francia</placeName> e dell'<placeName>Inghilterra</placeName> dal
                    <lb/>1140 circa fino al 1219. Vi sono preziosi particolari su <persName>Enrico au court
                    <lb/>Mantel</persName>, un racconto curiosissimo della salita al trono di <persName>Riccardo Cuor
                    <lb/>di Leone</persName>, molti fatti nuovi intorno alle guerre di <persName>Riccardo</persName> e di <persName>Fi-
                    <lb/>lippo Augusto</persName>, i torbidi in <placeName>Irlanda</placeName>, sotto il re <persName>Giovanni</persName>, l'invasione di
                    <lb/><persName>Luigi</persName>, figlio di <persName>Filippo Augusto</persName>, in <placeName>Inghilterra</placeName>, ecc. L'opera è già in-
                    <lb/>teramente copiata e si stamperà presto; intanto una notizia abbastanza
                    <lb/>estesa sarà pubblicata in uno dei prossimi numeri della <title><hi rend="italic">Romania</hi></title>.
                </p>
            </div>
        </body>
    </text>
</TEI>